{
  "$schema": "http://json-schema.org/draft-07/schema#",
  "title": "Certificate",
  "description": "Schema for single-page landscape completion or training certificates. Validates data.json for professional certificate generation.",
  "type": "object",
  "required": ["recipient", "course_name", "completion_date", "description", "signatories", "cert_id", "org_name"],
  "properties": {
    "recipient": {
      "type": "string",
      "description": "Full name of the certificate recipient"
    },
    "course_name": {
      "type": "string",
      "description": "Name of the course, program, or achievement"
    },
    "completion_date": {
      "type": "string",
      "description": "Completion date in human-readable format, e.g. 'April 6, 2026'"
    },
    "description": {
      "type": "string",
      "description": "Description of what was completed or achieved"
    },
    "signatories": {
      "type": "array",
      "minItems": 1,
      "maxItems": 3,
      "items": {
        "type": "object",
        "required": ["name", "title"],
        "properties": {
          "name": {
            "type": "string",
            "description": "Signatory full name"
          },
          "title": {
            "type": "string",
            "description": "Signatory title or role"
          }
        }
      },
      "description": "1-3 signatories with names and titles"
    },
    "cert_id": {
      "type": "string",
      "description": "Unique certificate identifier, e.g. 'CERT-2026-00142'"
    },
    "org_name": {
      "type": "string",
      "description": "Issuing organization name"
    },
    "org_logo": {
      "type": "string",
      "description": "Path to organization logo image (relative to pack root)"
    },
    "subtitle": {
      "type": "string",
      "description": "Optional subtitle below the main heading, e.g. 'Certificate of Completion'"
    }
  }
}
